{
  "code": "6B06101",
  "name": {
    "ru": "Информационные системы",
    "kz": "Ақпараттық жүйелер",
    "en": "Information Systems"
  },
  "group_code": "B057",
  "metadata": {
    "source_system": "external-import-service",
    "source_url": "https://example.kz/classifier",
    "collected_at": "2026-03-14T00:00:00Z",
    "notes": "Опционально: комментарии по качеству данных",
    "schema_version": "1.0.0"
  }
}
